{"$schema":"https://json-schema.org/draft/2020-12/schema","$id":"https://agensfield.dev/scriba/schemas/budget.schema.json","title":"Scriba budget report","type":"object","additionalProperties":false,"required":["schemaVersion","generatedAt","providerId","observedAt","history","windows"],"properties":{"schemaVersion":{"const":"scriba.budget.v1"},"generatedAt":{"type":"string","format":"date-time"},"providerId":{"type":"string"},"observedAt":{"type":"string","format":"date-time"},"history":{"$ref":"#/$defs/history"},"windows":{"type":"array","items":{"$ref":"#/$defs/window"}},"accountId":{"type":"string","pattern":"^acct-[0-9a-f]{20}$"},"accountAlias":{"type":"string","minLength":1,"maxLength":32},"credentialsAvailable":{"type":"boolean"},"observedAgeMs":{"type":"integer","minimum":0},"observationStale":{"type":"boolean"},"observationSource":{"type":"string","minLength":1}},"$defs":{"history":{"type":"object","additionalProperties":false,"required":["state","sampleCount"],"properties":{"state":{"enum":["available","empty","unavailable"]},"sampleCount":{"type":"integer","minimum":0}}},"nullableNumber":{"type":["number","null"]},"nullableInteger":{"type":["integer","null"]},"nullableDateTime":{"anyOf":[{"type":"string","format":"date-time"},{"type":"null"}]},"window":{"type":"object","additionalProperties":false,"required":["key","label","usedPercent","remainingPercentPoints","resetAt","periodDurationMs","timeRemainingMs","cycleBurnPercentPointsPerHour","recentBurnPercentPointsPerHour","paceBurnPercentPointsPerHour","safeHourlyAllowancePercentPoints","safeDailyAllowancePercentPoints","projectedExhaustionAt","temporalMarginMs","risk","freshness","confidence","reasons"],"properties":{"key":{"type":"string"},"label":{"type":"string"},"usedPercent":{"$ref":"#/$defs/nullableNumber"},"remainingPercentPoints":{"$ref":"#/$defs/nullableNumber"},"resetAt":{"$ref":"#/$defs/nullableDateTime"},"periodDurationMs":{"$ref":"#/$defs/nullableInteger"},"timeRemainingMs":{"$ref":"#/$defs/nullableInteger"},"cycleBurnPercentPointsPerHour":{"$ref":"#/$defs/nullableNumber"},"recentBurnPercentPointsPerHour":{"$ref":"#/$defs/nullableNumber"},"paceBurnPercentPointsPerHour":{"$ref":"#/$defs/nullableNumber"},"safeHourlyAllowancePercentPoints":{"$ref":"#/$defs/nullableNumber"},"safeDailyAllowancePercentPoints":{"$ref":"#/$defs/nullableNumber"},"projectedExhaustionAt":{"$ref":"#/$defs/nullableDateTime"},"temporalMarginMs":{"$ref":"#/$defs/nullableInteger"},"risk":{"enum":["unknown","low","elevated","high","critical"]},"freshness":{"enum":["unknown","fresh","aging","stale"]},"confidence":{"enum":["none","low","medium","high"]},"reasons":{"type":"array","items":{"type":"string"},"uniqueItems":true}}}}}
