{"generatedAt":"2026-07-12T12:00:00Z","history":{"sampleCount":1,"state":"available"},"observedAt":"2026-07-12T11:55:00Z","providerId":"codex","schemaVersion":"scriba.budget.v1","windows":[{"confidence":"medium","cycleBurnPercentPointsPerHour":6.857142857142857,"freshness":"fresh","key":"primary.five_hour","label":"5h","paceBurnPercentPointsPerHour":10,"periodDurationMs":18000000,"projectedExhaustionAt":"2026-07-12T19:55:00Z","reasons":["cycle_estimate_available","recent_estimate_available","pace_conservative_recent"],"recentBurnPercentPointsPerHour":10,"remainingPercentPoints":80,"resetAt":"2026-07-12T14:00:00Z","risk":"low","safeDailyAllowancePercentPoints":80,"safeHourlyAllowancePercentPoints":40,"temporalMarginMs":21300000,"timeRemainingMs":7200000,"usedPercent":20}]}
